paper_id	pdf_path	match_status	resolved_title	doi	year
sha256-385fab81847507f6	articles/protein_folding_and_design/Baker 2019 Cell - Induction of Potent Neutralizing Antibody Responses by a Designed Protein Nanoparticle Vaccine for Respiratory Syncytial Virus.pdf	matched	Induction of Potent Neutralizing Antibody Responses by a Designed Protein Nanoparticle Vaccine for Respiratory Syncytial Virus	10.1016/j.cell.2019.01.046	2019
sha256-2b2b3a53d711d09f	articles/protein_folding_and_design/Baker 2019 Nature - De novo design of potent and selective mimics of IL-2 and IL-15.pdf	matched	De novo design of potent and selective mimics of IL-2 and IL-15	10.1038/s41586-018-0830-7	2019
sha256-3dc5f3355d9a3e96	articles/protein_folding_and_design/Baker 2025 NatMethods - Atom-level enzyme active site scaffolding using RFdiffusion2.pdf	matched	Atom-level enzyme active site scaffolding using RFdiffusion2	10.1038/s41592-025-02975-x	2025
sha256-aefce89fdfba50d6	articles/protein_folding_and_design/Chothia 1980 - How different amino acid sequences determine similar protein structures - The structure and evolutionary dynamics of the globins.pdf	matched	How different amino acid sequences determine similar protein structures: the structure and evolutionary dynamics of the globins.	10.1016/0022-2836(80)90373-3	1980
sha256-b5b046aed0b4e4df	articles/protein_folding_and_design/Chothia 1984 - The principles that determine the structure of proteins.pdf	needs_manual_review	Hydrogen Bonds	10.3390/molecules28041616	2023
sha256-e6a65d1be18964b8	articles/protein_folding_and_design/Chothia 1994 - Principles Determining the Structure of Beta-Sheet Barrels in Proteins I.pdf	matched	Principles determining the structure of beta-sheet barrels in proteins. I. A theoretical analysis.	10.1016/0022-2836(94)90064-7	1994
sha256-8c7d910aac9b88c4	articles/protein_folding_and_design/Chothia 1994 - Principles Determining the Structure of Beta-Sheet Barrels in Proteins II.pdf	matched	Principles determining the structure of beta-sheet barrels in proteins. II. The observed structures.	10.1016/0022-2836(94)90065-5	1994
sha256-702deb45948766f0	articles/protein_folding_and_design/Cooper 2017 Biochem Molecular Bio Educ - Creating 3D physical models to probe student understanding of macromolecular structure.pdf	matched	Creating 3D physical models to probe student understanding of macromolecular structure	10.1002/bmb.21076	2017
sha256-3e823b9da01b5195	articles/protein_folding_and_design/FASEB - 1995 - Reardon - The structure and evolution of alpha-beta barrel proteins.pdf	not_found	The structure and evolution o a/3 barrel proteins		2020
sha256-ae1d526e06627495	articles/protein_folding_and_design/Hanukoglu 2015 - Rossmann fold  A beta‐alpha‐beta fold at dinucleotide binding.pdf	matched	Multimedia in Biochemistry and Molecular Biology Education		2015
sha256-7ac06c6ceac261fc	articles/protein_folding_and_design/Hunter 2009 NAR - InterPro the integrative protein signature database.pdf	matched_via_doi	InterPro: the integrative protein signature database	10.1093/nar/gkn785	2009
sha256-fa9e7489127906a7	articles/protein_folding_and_design/Koga 2023 NSMB - Exploration of novel alpha-beta-protein folds through de novo design.pdf	matched_via_doi	Exploration of novel αβ-protein folds through de novo design	10.1038/s41594-023-01029-0	2023
sha256-4e5d326decc2cf0c	articles/protein_folding_and_design/Levitt - On the universe of protein folds.pdf	matched	On the universe of protein folds.	10.1146/annurev-biophys-083012-130432	2013
sha256-4e24b8e334cacb9c	articles/protein_folding_and_design/Levitt 2015 - The language of the protein universe.pdf	matched	The language of the protein universe.	10.1016/j.gde.2015.08.010	2015
sha256-9c91bc62f64087d6	articles/protein_folding_and_design/Levitt 2018 - Unique function words characterize genomic proteins.pdf	matched	Unique function words characterize genomic proteins	10.1073/pnas.1801182115	2018
sha256-697c7f581e30731b	articles/protein_folding_and_design/Listgarten 2026 Science - How artificial intelligence isreengineering protein engineering.pdf	matched	How artificial intelligence is reengineering protein engineering	10.1126/science.aec8444	2026
sha256-a062da666ccf7c71	articles/protein_folding_and_design/Medvedev 2021 JMolBiol - A Fifth of the Protein World - Rossmann-like Proteins as an Evolutionarily Successful Structural unit.pdf	matched_via_doi	A Fifth of the Protein World: Rossmann-like Proteins as an Evolutionarily Successful Structural unit	10.1016/j.jmb.2020.166788	2021
sha256-431c498a0d06775b	articles/protein_folding_and_design/Protein Supersecondary Structures.pdf	matched	Protein Supersecondary Structures	10.1007/978-1-4939-9161-7	2019
sha256-332a373258fe5b7e	articles/protein_folding_and_design/Rose 1988 Science - Helix Signals in Proteins.pdf	matched	Helix signals in proteins.	10.1126/SCIENCE.2837824	1988
sha256-72bf99e4f10a935d	articles/protein_folding_and_design/Rose 2006 PNAS - a-backbone-based-theory-of-protein-folding.pdf	matched	A backbone-based theory of protein folding	10.1073/pnas.0606843103	2006
sha256-f5b718491c976254	articles/protein_folding_and_design/Searls 2002 - The language of genes.pdf	matched	The language of genes	10.1038/nature01255	2002
sha256-e96b56af7638261e	articles/protein_folding_and_design/Starner 2015 - Ancestral protein reconstruction - techniques and applications.pdf	matched_via_doi	Ancestral protein reconstruction: techniques and applications	10.1515/hsz-2015-0158	2016
sha256-1a33b59a46a6da54	articles/protein_stability_mutagenesis/1-s2.0-S0959440X2200197X-main.pdf	matched_via_doi	Using machine learning to predict the effects and consequences of mutations in proteins	10.1016/j.sbi.2022.102518	2023
sha256-633286521d677cf9	articles/protein_stability_mutagenesis/1-s2.0-S2211124721017113-main.pdf	matched_via_doi	Predicting and interpreting large-scale mutagenesis data using analyses of protein stability and conservation	10.1016/j.celrep.2021.110207	2022
sha256-ba4627dc219b2f6f	articles/protein_stability_mutagenesis/Dieckhaus 2024 PNAS - transfer-learning-to-leverage-larger-datasets-for-improved-prediction-of-protein-stability-changes.pdf	needs_manual_review	Transfer learning to leverage larger datasets for improved prediction of protein stability changes	10.1101/2023.07.27.550881	2023
sha256-8ab50ed00b7d4108	articles/protein_stability_mutagenesis/Protein Science - 2022 - Sora.pdf	matched_via_doi	"<scp>RosettaDDGPrediction</scp>
                    for high‐throughput mutational scans: From stability to binding"	10.1002/pro.4527	2023
sha256-e7533743a86c2549	articles/protein_stability_mutagenesis/elife-82593-v2.pdf	matched	Rapid protein stability prediction using deep learning representations	10.1101/2022.07.14.500157	2023
sha256-fdd02160518c9229	articles/self-assembly/tezcan_2021_ChemRev_protein_assembly_design_review.pdf	needs_manual_review	261st American Chemical Society (ACS) National Meeting & Exposition. Virtual - April 5-16, 2021	10.1358/dof.2021.46.6.3310145	2021
sha256-b70cad2792835ec5	articles/soft_matter_theory/degennes_1985_RevModPhys_wetting.pdf	not_found	Fundamentals and Applications of Surface Wetting.	10.1021/acs.langmuir.3c03339	2024
sha256-aa5720607a9eaada	articles/soft_matter_theory/fisher_1982_PRL_wetting_landau.pdf	not_found	Evolution of nonconformal Landau-Levich-Bretherton films of partially wetting liquids	10.1103/PHYSREVFLUIDS.3.014203	2018
sha256-cda1ada88d139261	articles/soft_matter_theory/saam_1977_PRL_prewetting_dft.pdf	not_found	On Necessary and Sufficient Conditions for Local Controllability Along a Reference Trajectory	10.1007/978-94-010-2675-8_7	1973
